{
  "schema_version": 1,
  "book": {
    "book_id": 5,
    "slug": "a-genese",
    "title": "A Gênese"
  },
  "source": {
    "source_file": "WEB-A-Genese-Guillon.pdf",
    "source_sha256": "c8589e820ee845ceef851f94b697153d82a8d858dd34d99aac694dae22b16488",
    "toc_pdf_pages": [
      6,
      7,
      8,
      9
    ],
    "toc_text_sha256": "dd6317961f1b789f09a08a1e9be57ca03088d251b7cdb2bfc413db75b61b4bf0",
    "rights_status": "permission-required-for-production"
  },
  "counts": {
    "front_matter": 2,
    "divisions": 3,
    "chapters": 18,
    "groups": 6,
    "sections": 115,
    "back_matter": 2,
    "total_nodes": 146
  },
  "nodes": [
    {
      "id": "a-genese:front_matter:19b929fd38d1afa2",
      "source_key": "19b929fd38d1afa2",
      "parent_id": null,
      "order": 1,
      "depth": 0,
      "type": "front_matter",
      "label": null,
      "title": "Nota da Editora",
      "source_pdf_page": 6,
      "printed_page": 9,
      "locator": null
    },
    {
      "id": "a-genese:front_matter:644fea731d3f9981",
      "source_key": "644fea731d3f9981",
      "parent_id": null,
      "order": 2,
      "depth": 0,
      "type": "front_matter",
      "label": null,
      "title": "Introdução",
      "source_pdf_page": 6,
      "printed_page": 11,
      "locator": null
    },
    {
      "id": "a-genese:division:35951e5f8c1ad9fe",
      "source_key": "35951e5f8c1ad9fe",
      "parent_id": null,
      "order": 3,
      "depth": 0,
      "type": "division",
      "label": null,
      "title": "A Gênese segundo o Espiritismo",
      "source_pdf_page": 6,
      "printed_page": null,
      "locator": null
    },
    {
      "id": "a-genese:chapter:af0595094b00dbc4",
      "source_key": "af0595094b00dbc4",
      "parent_id": "a-genese:division:35951e5f8c1ad9fe",
      "order": 4,
      "depth": 1,
      "type": "chapter",
      "label": "Capítulo I",
      "title": "Caráter da revelação espírita",
      "source_pdf_page": 6,
      "printed_page": 17,
      "locator": null
    },
    {
      "id": "a-genese:chapter:7a69729d545d44ec",
      "source_key": "7a69729d545d44ec",
      "parent_id": "a-genese:division:35951e5f8c1ad9fe",
      "order": 5,
      "depth": 1,
      "type": "chapter",
      "label": "Capítulo II",
      "title": "Deus",
      "source_pdf_page": 6,
      "printed_page": 49,
      "locator": null
    },
    {
      "id": "a-genese:section:1cc749a484f3787d",
      "source_key": "1cc749a484f3787d",
      "parent_id": "a-genese:chapter:7a69729d545d44ec",
      "order": 6,
      "depth": 2,
      "type": "section",
      "label": null,
      "title": "Existência de Deus",
      "source_pdf_page": 6,
      "printed_page": null,
      "locator": {
        "type": "printed_page",
        "value": 49
      }
    },
    {
      "id": "a-genese:section:6e289fb52ab4300e",
      "source_key": "6e289fb52ab4300e",
      "parent_id": "a-genese:chapter:7a69729d545d44ec",
      "order": 7,
      "depth": 2,
      "type": "section",
      "label": null,
      "title": "Da natureza divina",
      "source_pdf_page": 6,
      "printed_page": null,
      "locator": {
        "type": "printed_page",
        "value": 51
      }
    },
    {
      "id": "a-genese:section:8db39298159e9943",
      "source_key": "8db39298159e9943",
      "parent_id": "a-genese:chapter:7a69729d545d44ec",
      "order": 8,
      "depth": 2,
      "type": "section",
      "label": null,
      "title": "A Providência",
      "source_pdf_page": 6,
      "printed_page": null,
      "locator": {
        "type": "printed_page",
        "value": 55
      }
    },
    {
      "id": "a-genese:section:becc0d198df71200",
      "source_key": "becc0d198df71200",
      "parent_id": "a-genese:chapter:7a69729d545d44ec",
      "order": 9,
      "depth": 2,
      "type": "section",
      "label": null,
      "title": "A visão de Deus",
      "source_pdf_page": 6,
      "printed_page": null,
      "locator": {
        "type": "printed_page",
        "value": 59
      }
    },
    {
      "id": "a-genese:chapter:ba73a1edf9cf0984",
      "source_key": "ba73a1edf9cf0984",
      "parent_id": "a-genese:division:35951e5f8c1ad9fe",
      "order": 10,
      "depth": 1,
      "type": "chapter",
      "label": "Capítulo III",
      "title": "O bem e o mal",
      "source_pdf_page": 6,
      "printed_page": 63,
      "locator": null
    },
    {
      "id": "a-genese:section:2ef1a83403eee616",
      "source_key": "2ef1a83403eee616",
      "parent_id": "a-genese:chapter:ba73a1edf9cf0984",
      "order": 11,
      "depth": 2,
      "type": "section",
      "label": null,
      "title": "Origem do bem e do mal",
      "source_pdf_page": 6,
      "printed_page": null,
      "locator": {
        "type": "printed_page",
        "value": 63
      }
    },
    {
      "id": "a-genese:section:3a94d77b84a2e939",
      "source_key": "3a94d77b84a2e939",
      "parent_id": "a-genese:chapter:ba73a1edf9cf0984",
      "order": 12,
      "depth": 2,
      "type": "section",
      "label": null,
      "title": "O instinto e a inteligência",
      "source_pdf_page": 6,
      "printed_page": null,
      "locator": {
        "type": "printed_page",
        "value": 67
      }
    },
    {
      "id": "a-genese:section:f372f8a647f3409e",
      "source_key": "f372f8a647f3409e",
      "parent_id": "a-genese:chapter:ba73a1edf9cf0984",
      "order": 13,
      "depth": 2,
      "type": "section",
      "label": null,
      "title": "Destruição dos seres vivos uns pelos outros",
      "source_pdf_page": 6,
      "printed_page": null,
      "locator": {
        "type": "printed_page",
        "value": 72
      }
    },
    {
      "id": "a-genese:chapter:b7284bbc42f35bcf",
      "source_key": "b7284bbc42f35bcf",
      "parent_id": "a-genese:division:35951e5f8c1ad9fe",
      "order": 14,
      "depth": 1,
      "type": "chapter",
      "label": "Capítulo IV",
      "title": "Papel da Ciência na Gênese",
      "source_pdf_page": 6,
      "printed_page": 75,
      "locator": null
    },
    {
      "id": "a-genese:chapter:a2a42f3b752ead20",
      "source_key": "a2a42f3b752ead20",
      "parent_id": "a-genese:division:35951e5f8c1ad9fe",
      "order": 15,
      "depth": 1,
      "type": "chapter",
      "label": "Capítulo V",
      "title": "Antigos e modernos sistemas do mundo",
      "source_pdf_page": 6,
      "printed_page": 83,
      "locator": null
    },
    {
      "id": "a-genese:chapter:13b8701c61562c39",
      "source_key": "13b8701c61562c39",
      "parent_id": "a-genese:division:35951e5f8c1ad9fe",
      "order": 16,
      "depth": 1,
      "type": "chapter",
      "label": "Capítulo VI",
      "title": "Uranografia geral",
      "source_pdf_page": 6,
      "printed_page": 91,
      "locator": null
    },
    {
      "id": "a-genese:section:fea241074d671c5b",
      "source_key": "fea241074d671c5b",
      "parent_id": "a-genese:chapter:13b8701c61562c39",
      "order": 17,
      "depth": 2,
      "type": "section",
      "label": null,
      "title": "O espaço e o tempo",
      "source_pdf_page": 6,
      "printed_page": null,
      "locator": {
        "type": "printed_page",
        "value": 91
      }
    },
    {
      "id": "a-genese:section:eedb3d40d7a997e5",
      "source_key": "eedb3d40d7a997e5",
      "parent_id": "a-genese:chapter:13b8701c61562c39",
      "order": 18,
      "depth": 2,
      "type": "section",
      "label": null,
      "title": "A matéria",
      "source_pdf_page": 6,
      "printed_page": null,
      "locator": {
        "type": "printed_page",
        "value": 94
      }
    },
    {
      "id": "a-genese:section:15010139e77461c3",
      "source_key": "15010139e77461c3",
      "parent_id": "a-genese:chapter:13b8701c61562c39",
      "order": 19,
      "depth": 2,
      "type": "section",
      "label": null,
      "title": "As leis e as forças",
      "source_pdf_page": 6,
      "printed_page": null,
      "locator": {
        "type": "printed_page",
        "value": 97
      }
    },
    {
      "id": "a-genese:section:54f40b8c84d0cede",
      "source_key": "54f40b8c84d0cede",
      "parent_id": "a-genese:chapter:13b8701c61562c39",
      "order": 20,
      "depth": 2,
      "type": "section",
      "label": null,
      "title": "A criação primária",
      "source_pdf_page": 6,
      "printed_page": null,
      "locator": {
        "type": "printed_page",
        "value": 99
      }
    },
    {
      "id": "a-genese:section:2c807b1d9605ef63",
      "source_key": "2c807b1d9605ef63",
      "parent_id": "a-genese:chapter:13b8701c61562c39",
      "order": 21,
      "depth": 2,
      "type": "section",
      "label": null,
      "title": "A criação universal",
      "source_pdf_page": 6,
      "printed_page": null,
      "locator": {
        "type": "printed_page",
        "value": 102
      }
    },
    {
      "id": "a-genese:section:cbbc3e0534b221b2",
      "source_key": "cbbc3e0534b221b2",
      "parent_id": "a-genese:chapter:13b8701c61562c39",
      "order": 22,
      "depth": 2,
      "type": "section",
      "label": null,
      "title": "Os sóis e os planetas",
      "source_pdf_page": 6,
      "printed_page": null,
      "locator": {
        "type": "printed_page",
        "value": 104
      }
    },
    {
      "id": "a-genese:section:6d0b10c401780982",
      "source_key": "6d0b10c401780982",
      "parent_id": "a-genese:chapter:13b8701c61562c39",
      "order": 23,
      "depth": 2,
      "type": "section",
      "label": null,
      "title": "Os satélites",
      "source_pdf_page": 6,
      "printed_page": null,
      "locator": {
        "type": "printed_page",
        "value": 105
      }
    },
    {
      "id": "a-genese:section:d8e88d5ca3643c43",
      "source_key": "d8e88d5ca3643c43",
      "parent_id": "a-genese:chapter:13b8701c61562c39",
      "order": 24,
      "depth": 2,
      "type": "section",
      "label": null,
      "title": "Os cometas",
      "source_pdf_page": 6,
      "printed_page": null,
      "locator": {